{"tried":
 [{"verdict": "KEEP",
   "target": "27 recursive declarations",
   "suggested":
   "state each measure Lean found (`showInferredTerminationBy`) after its declaration",
   "sites": 27,
   "reasons": ["compile heartbeats: 751102.55 kHB -> 655223.03 kHB"],
   "rank": 2,
   "outcome": "improved",
   "observed":
   ["27 declarations without `termination_by` in 15 files: Lean tries measures until one works, running `decreasing_tactic` for each",
    "`decreasing_tactic` ran 193× in 25 files in all",
    "their `decreasing_tactic` calls cost 133555.16 kHB (each declaration's own; these do not overlap one another)"],
   "not_mechanical": "",
   "modules_dearer": [],
   "modules_cheaper":
   [{"key": "Batteries/Data/String/Lemmas.lean",
     "candidate": 55322174,
     "base": 76910192},
    {"key": "Batteries/Recycling/RBTree/Lemmas.lean",
     "candidate": 56450652,
     "base": 73742712},
    {"key": "Batteries/Data/BinaryHeap/Lemmas.lean",
     "candidate": 55113245,
     "base": 69417837},
    {"key": "Batteries/Data/Nat/Bisect.lean",
     "candidate": 13790187,
     "base": 28045058},
    {"key": "Batteries/Data/BinaryHeap/Basic.lean",
     "candidate": 13839910,
     "base": 20942103},
    {"key": "Batteries/Data/Random/MersenneTwister.lean",
     "candidate": 7077855,
     "base": 12283968},
    {"key": "Batteries/Data/Vector/Basic.lean",
     "candidate": 9341727,
     "base": 14115862},
    {"key": "Batteries/Data/Array/Basic.lean",
     "candidate": 23549606,
     "base": 28147844},
    {"key": "Batteries/Data/List/Lemmas.lean",
     "candidate": 91748567,
     "base": 94620232},
    {"key": "Batteries/Data/Fin/Fold.lean",
     "candidate": 5298099,
     "base": 7245664},
    {"key": "Batteries/Data/Fin/Basic.lean",
     "candidate": 2424491,
     "base": 4314813}],
   "modules":
   ["Batteries.Data.Array.Basic",
    "Batteries.Data.BinaryHeap.Basic",
    "Batteries.Data.BinaryHeap.Lemmas",
    "Batteries.Data.Fin.Basic",
    "Batteries.Data.Fin.Fold",
    "Batteries.Data.List.Basic",
    "Batteries.Data.List.Lemmas",
    "Batteries.Data.Nat.Basic",
    "Batteries.Data.Nat.Bisect",
    "Batteries.Data.PairingHeap",
    "Batteries.Data.Random.MersenneTwister",
    "Batteries.Data.String.Lemmas",
    "Batteries.Data.Vector.Basic",
    "Batteries.Recycling.MonadSatisfying.Array",
    "Batteries.Recycling.RBTree.Lemmas",
    "Batteries.Recycling.MonadSatisfying.Vector",
    "Batteries.Recycling.RBTree",
    "Batteries.Recycling.MonadSatisfying",
    "Batteries.CodeAction.Match",
    "Batteries.Data.String",
    "Batteries.Data.Fin",
    "Batteries.Data.Int",
    "Batteries.Data.Fin.Lemmas",
    "Batteries.Data.List",
    "Batteries.Data.Array.Lemmas",
    "Batteries.Data.Array.Scan",
    "Batteries.Data.Array.Monadic",
    "Batteries.Data.AssocList.Lemmas",
    "Batteries.Data.Nat.Lemmas",
    "Batteries.Data.Nat",
    "Batteries.Data.BinaryHeap.WF",
    "Batteries.Data.Vector",
    "Batteries.Data.List.Count",
    "Batteries.Data.List.Pairwise",
    "Batteries.Data.List.Scan",
    "Batteries.Data.List.Perm",
    "Batteries.Data.BinaryHeap",
    "Batteries.Data.Array",
    "Batteries.Data.Vector.Lemmas",
    "Batteries.Data.RBMap.Lemmas",
    "Batteries.Data.Random",
    "BatteriesTest.list_sublists",
    "BatteriesTest.MLList",
    "BatteriesTest.array_scan",
    "BatteriesTest.mersenne_twister",
    "Batteries",
    "Batteries.CodeAction",
    "Batteries.Data.RBMap",
    "Batteries.Data.Fin.Coding",
    "Batteries.Data.Fin.OfBits",
    "Batteries.Data.BitVec.Lemmas",
    "Batteries.Data.AssocList",
    "Batteries.Data.Vector.Monadic",
    "BatteriesTest.ImportLeanExplicit",
    "BatteriesTest.list_enumeration",
    "BatteriesTest.import_lean",
    "BatteriesTest.ImportLean",
    "BatteriesTest.vector",
    "BatteriesTest.binaryHeap",
    "BatteriesTest.array",
    "Batteries.Data.BitVec"],
   "mechanical": true,
   "load_avg": ["15.83 12.96 17.26", "23.40 16.51 16.17"],
   "kind": "termination",
   "in_files":
   ["Batteries/Data/String/Lemmas.lean",
    "Batteries/Recycling/RBTree/Lemmas.lean",
    "Batteries/Data/BinaryHeap/Lemmas.lean",
    "Batteries/Data/Random/MersenneTwister.lean",
    "Batteries/Data/Nat/Bisect.lean",
    "Batteries/Data/Vector/Basic.lean",
    "Batteries/Data/BinaryHeap/Basic.lean",
    "Batteries/Data/Array/Basic.lean",
    "Batteries/Data/List/Basic.lean",
    "Batteries/Data/List/Lemmas.lean",
    "Batteries/Data/Fin/Fold.lean",
    "Batteries/Data/Fin/Basic.lean",
    "Batteries/Recycling/MonadSatisfying/Array.lean",
    "Batteries/Data/PairingHeap.lean",
    "Batteries/Data/Nat/Basic.lean"],
   "heartbeats_candidate": 655223031,
   "heartbeats_base": 751102545,
   "files": 15,
   "evidence":
   {"version": 1,
    "verdict": "KEEP",
    "try": 1,
    "tests": {"passed": true, "command": "lake test"},
    "seconds": 275.270863,
    "schema": {"version": 1, "name": "leanprof.experiment-try"},
    "retryable": false,
    "reasons": ["compile heartbeats: 751102.55 kHB -> 655223.03 kHB"],
    "provenance":
    {"workload":
     {"inputs": [],
      "executable": "",
      "binary_hash": null,
      "args_hash": "cbf29ce484222325",
      "args": []},
     "platform": {"target": "arm64-apple-darwin24.6.0", "os": "macos"},
     "leanprof_version": "0.1.0",
     "lean":
     {"version": "4.35.0",
      "commit": "eb6cafb7290e8bd5f2937522d8d804f58f02bafc"},
     "git":
     {"rev": "66e469188fe07963e5cf666c7d4433f45b8131c5",
      "dirty_fingerprint": null,
      "dirty": false},
     "created": "2026-10-28T16:22:26Z",
     "build": {"runs": 3, "pairs": 30, "mode": "library", "min_change": 1}},
    "outcome": "improved",
    "mode": "library",
    "measurement_valid": true,
    "leanprof": "experiment-try",
    "heartbeats":
    {"worse": [],
     "why": "a library: the measure is compile heartbeats",
     "notes":
     ["compile Batteries/Data/PairingHeap.lean Heap.size_combine: 1456.49 kHB -> 1412.12 kHB",
      "compile Batteries/Data/Array/Basic.lean scanrM: 3159.09 kHB -> 2564.43 kHB",
      "compile Batteries/Data/String/Lemmas.lean firstDiffPos_loop_eq: 17423.59 kHB -> 6155.43 kHB",
      "compile Batteries/Data/List/Lemmas.lean dropInfix?_go_eq_some_iff: 8246.67 kHB -> 6516.66 kHB",
      "compile Batteries/Recycling/RBTree/Lemmas.lean zoom_del: 15838.88 kHB -> 5864.49 kHB",
      "compile Batteries/Data/BinaryHeap/Lemmas.lean toSortedArray.loop_sorted: 10122.88 kHB -> 2718.97 kHB",
      "compile Batteries/Data/Array/Basic.lean scanlM: 6322.14 kHB -> 2315.71 kHB",
      "compile Batteries/Data/List/Lemmas.lean dropPrefix?_eq_some_iff: 3297.75 kHB -> 2155.25 kHB",
      "compile Batteries/Recycling/RBTree/Lemmas.lean zoom_ins: 14166.59 kHB -> 6884.37 kHB",
      "compile Batteries/Data/Nat/Bisect.lean bisect_true: 6177.26 kHB -> 2620.01 kHB",
      "compile Batteries/Data/Fin/Basic.lean dfoldlM: 3231.76 kHB -> 1341.45 kHB",
      "compile Batteries/Data/BinaryHeap/Basic.lean toSortedArray: 5165.45 kHB -> 870.45 kHB",
      "compile Batteries/Recycling/RBTree/Lemmas.lean min?_reverse: 1457.23 kHB -> 1421.39 kHB",
      "compile Batteries/Data/Nat/Bisect.lean start_le_bisect: 6124.33 kHB -> 2565.79 kHB",
      "compile Batteries/Data/BinaryHeap/Lemmas.lean toSortedArray.loop_perm: 8207.97 kHB -> 1306.96 kHB",
      "compile Batteries/Data/Vector/Basic.lean scanrM: 3389.09 kHB -> 2847.46 kHB",
      "compile Batteries/Data/Nat/Bisect.lean bisect_lt_stop: 6125.75 kHB -> 2567.34 kHB",
      "compile Batteries/Data/Nat/Bisect.lean bisect_add_one_false: 6274.55 kHB -> 2693.88 kHB",
      "compile Batteries/Data/BinaryHeap/Basic.lean heapifyUp: 7509.45 kHB -> 4702.12 kHB",
      "compile Batteries/Data/Nat/Basic.lean strongRec: 393.17 kHB -> 386.71 kHB",
      "compile Batteries/Data/Vector/Basic.lean scanlM: 5731.48 kHB -> 1498.66 kHB",
      "compile Batteries/Data/Random/MersenneTwister.lean Config.init: 6775.73 kHB -> 1570.86 kHB",
      "compile Batteries/Data/String/Lemmas.lean splitAux_of_valid: 16273.76 kHB -> 5953.81 kHB",
      "compile Batteries/Data/Fin/Fold.lean dfoldlM_loop: 3558.96 kHB -> 1611.41 kHB"],
     "files":
     ["Batteries/Data/Array/Basic.lean",
      "Batteries/Data/BinaryHeap/Basic.lean",
      "Batteries/Data/BinaryHeap/Lemmas.lean",
      "Batteries/Data/Fin/Basic.lean",
      "Batteries/Data/Fin/Fold.lean",
      "Batteries/Data/List/Basic.lean",
      "Batteries/Data/List/Lemmas.lean",
      "Batteries/Data/Nat/Basic.lean",
      "Batteries/Data/Nat/Bisect.lean",
      "Batteries/Data/PairingHeap.lean",
      "Batteries/Data/Random/MersenneTwister.lean",
      "Batteries/Data/String/Lemmas.lean",
      "Batteries/Data/Vector/Basic.lean",
      "Batteries/Recycling/MonadSatisfying/Array.lean",
      "Batteries/Recycling/RBTree/Lemmas.lean",
      "Batteries/Recycling/MonadSatisfying/Vector.lean",
      "Batteries/Recycling/RBTree.lean",
      "Batteries/Recycling/MonadSatisfying.lean",
      "Batteries/CodeAction/Match.lean",
      "Batteries/Data/String.lean",
      "Batteries/Data/Fin.lean",
      "Batteries/Data/Int.lean",
      "Batteries/Data/Fin/Lemmas.lean",
      "Batteries/Data/List.lean",
      "Batteries/Data/Array/Lemmas.lean",
      "Batteries/Data/Array/Scan.lean",
      "Batteries/Data/Array/Monadic.lean",
      "Batteries/Data/AssocList/Lemmas.lean",
      "Batteries/Data/Nat/Lemmas.lean",
      "Batteries/Data/Nat.lean",
      "Batteries/Data/BinaryHeap/WF.lean",
      "Batteries/Data/Vector.lean",
      "Batteries/Data/List/Count.lean",
      "Batteries/Data/List/Pairwise.lean",
      "Batteries/Data/List/Scan.lean",
      "Batteries/Data/List/Perm.lean",
      "Batteries/Data/BinaryHeap.lean",
      "Batteries/Data/Array.lean",
      "Batteries/Data/Vector/Lemmas.lean",
      "Batteries/Data/RBMap/Lemmas.lean",
      "Batteries/Data/Random.lean",
      "BatteriesTest/list_sublists.lean",
      "BatteriesTest/MLList.lean",
      "BatteriesTest/array_scan.lean",
      "BatteriesTest/mersenne_twister.lean",
      "Batteries.lean",